{
  "id": "recipe_egg_toast",
  "name": "계란토스트",
  "description": "아침에 빠르게 만들 수 있는 계란과 식빵 토스트",
  "version": "1.0.0",
  "status": "active",
  "baseServings": 6,
  "difficulty": "easy",
  "time": {
    "prepMinutes": 5,
    "cookMinutes": 10,
    "restMinutes": 0,
    "totalMinutes": 15
  },
  "ingredients": [
    {
      "ingredientId": "ingredient_bread",
      "name": "식빵",
      "group": "main",
      "quantity": 6,
      "unit": "slice",
      "scaling": {
        "mode": "discrete",
        "step": 1,
        "rounding": "up"
      },
      "inventoryTracked": true,
      "shoppingEligible": true
    },
    {
      "ingredientId": "ingredient_egg",
      "name": "계란",
      "group": "main",
      "quantity": 6,
      "unit": "piece",
      "scaling": {
        "mode": "discrete",
        "step": 1,
        "rounding": "up"
      },
      "inventoryTracked": true,
      "shoppingEligible": true
    },
    {
      "ingredientId": "ingredient_butter",
      "name": "버터",
      "group": "seasoning",
      "quantity": 30,
      "unit": "g",
      "scaling": {
        "mode": "gentle",
        "step": 5
      },
      "inventoryTracked": true,
      "shoppingEligible": true
    },
    {
      "ingredientId": "ingredient_salt",
      "name": "소금",
      "group": "seasoning",
      "quantity": 2,
      "unit": "pinch",
      "scaling": {
        "mode": "minimal",
        "step": 1
      },
      "inventoryTracked": false,
      "shoppingEligible": false
    },
    {
      "ingredientId": "ingredient_ketchup",
      "name": "케첩",
      "group": "optional",
      "quantity": 6,
      "unit": "tbsp",
      "scaling": {
        "mode": "linear",
        "step": 0.5
      },
      "inventoryTracked": true,
      "shoppingEligible": true,
      "optional": true
    }
  ],
  "preparation": [
    {
      "order": 1,
      "instruction": "계란을 그릇에 깨고 소금 2꼬집을 넣어 흰자와 노른자가 섞일 정도로만 푼다.",
      "minutes": 2
    }
  ],
  "steps": [
    {
      "order": 1,
      "title": "식빵 굽기",
      "instruction": "팬을 중약불로 예열하고 버터 절반을 녹인 뒤 식빵을 앞뒤로 1분씩 굽는다.",
      "heat": "medium_low",
      "minutes": 4,
      "timerRecommended": true,
      "completionCue": "식빵 표면이 옅은 갈색이고 가장자리가 바삭하다."
    },
    {
      "order": 2,
      "title": "계란 익히기",
      "instruction": "남은 버터를 녹이고 계란물을 넓게 부어 중약불에서 익힌다. 가장자리가 익으면 식빵 크기로 접는다.",
      "heat": "medium_low",
      "minutes": 4,
      "timerRecommended": true,
      "completionCue": "계란 표면에 흐르는 액체가 거의 없다."
    },
    {
      "order": 3,
      "title": "완성",
      "instruction": "식빵 사이에 계란을 넣고 취향에 따라 케첩을 바른다.",
      "heat": "none",
      "minutes": 2,
      "timerRecommended": false,
      "completionCue": "바로 먹을 수 있도록 접시에 담는다."
    }
  ],
  "tips": [
    "불이 강하면 버터와 식빵이 빨리 타므로 중약불을 유지한다.",
    "여러 장을 만들 때 구운 식빵은 접시 위에 겹치지 않는다."
  ],
  "substitutions": [
    {
      "ingredientId": "ingredient_butter",
      "alternatives": [
        "식용유",
        "마가린"
      ]
    }
  ],
  "sideDishes": [
    "우유",
    "바나나",
    "방울토마토"
  ],
  "storage": {
    "refrigeratedDays": 1,
    "frozenDays": null,
    "reheat": "가능하면 바로 먹고, 보관한 경우 전자레인지보다 팬에 약불로 데운다."
  },
  "metadata": {
    "cuisine": [
      "간편식"
    ],
    "mealTypes": [
      "breakfast"
    ],
    "tags": [
      "아침",
      "15분",
      "계란"
    ],
    "spiceLevel": 0,
    "kidFriendly": true,
    "freezerFriendly": false,
    "weekdayFriendly": true,
    "estimatedCostKrw": 7000
  },
  "verification": {
    "level": "tested_once",
    "testedCount": 1,
    "notes": "기본 아침 메뉴",
    "verifiedAt": null
  },
  "revision": {
    "notes": "WS-02 schema 최초 작성",
    "previousVersionId": null,
    "updatedAt": "2026-07-24T00:00:00+09:00"
  },
  "warnings": [
    "계란은 완전히 익혀 제공한다."
  ],
  "allergens": [
    "계란",
    "우유",
    "밀"
  ]
}